{
  "schema_version": 2,
  "id": "NUR-FEAT-001",
  "title": "收敛单主体苗木站商城入口与路由",
  "type": "feature",
  "priority": "P0",
  "phase": 1,
  "risk_level": "L3",
  "status": "approved_for_implementation",
  "requirement_ids": [
    "FR-HOME-001",
    "FR-CENTER-001"
  ],
  "decision_ids": [],
  "business_goal": "以项目级 nursery 插件把 ShopXO 6.9.0 收敛为单一经营主体的苗木展示站：首页、商品详情、移动底部导航和用户中心不再提供购物车、结算、订单、支付、售后或积分入口，对应 Web、API、后台及已知商城插件路由同时失败关闭，且保留分类、搜索、商品展示、登录、资料、收藏和浏览历史能力。",
  "in_scope": [
    "创建可由 ShopXO 正常安装和启用的 nursery 插件骨架，并在 config.json 登记经过源码验证的系统、导航、商品按钮、视图和后台菜单钩子。",
    "使用固定大小写无关拒绝表，在 plugins_service_system_begin 阻断 index、api、admin 的购物车、结算、订单、支付、售后、积分及关联后台控制器，并阻断已知 PX 商城插件入口。",
    "Web 固定拒绝 buy、cart、order、orderaftersale、pay、useraddress、usergoodscomments、userintegral；API 固定拒绝 buy、cart、cashier、order、orderaftersale、ordernotify、paylog、useraddress、usergoodscomments、userintegral。",
    "后台固定拒绝 express、goodscart、goodscomments、integrallog、order、orderaftersale、payment、paylog、payrequestlog、refundlog、warehouse、warehousegoods；同步过滤 admin_left_menu、admin_power、admin_plugins 和 admin_all_plugins，插件菜单按 plugins-<name> 的 id/key 及插件 URL 识别。",
    "过滤数据库头尾导航、顶部快捷导航、H5 首页/用户中心导航、移动底部导航、用户中心左侧/mini 导航中的排除能力，同时从商品详情按钮集合移除 buy 和 cart。",
    "通过 plugins_view_assign_data 清除首页订单状态数据，并通过 plugins_view_fetch_begin 将用户中心首页切换到插件自有视图，彻底移除原模板硬编码的订单和购物车区块。",
    "新增无第三方依赖的离线合同测试，验证插件清单、拒绝表、Hook 注册、正负路由边界、视图无 PX 链接以及未修改上游商城源码。"
  ],
  "out_of_scope": [
    "物理删除 ShopXO 的供应商、多商户、分销、购物车、订单、支付、退款售后、积分、优惠券和营销源码或数据库表。",
    "苗木分类数据、规格参数模板、公开参考价格校验、零价上架守卫、价格免责声明和价格历史。",
    "询价表、询价页面、询价状态/回复、收藏唯一索引、行为分析、运营看板和数据导出。",
    "完整 nursery 视觉主题、首页重设计、列表/详情重设计、图片素材和浏览器视觉验收。",
    "安装或启用插件、生成 app/event.php、修改生产数据库、连接服务器或执行远程发布。"
  ],
  "business_invariants": [
    "排除能力必须同时从可见入口、直达 Web/API 路由和后台菜单权限收敛；隐藏链接不能替代路由拒绝。",
    "分类、搜索、商品列表/详情、登录、个人资料、账号安全、商品收藏和浏览历史不得被拒绝表误伤。",
    "商品详情不得产生 buy 或 cart 按钮；展示型商品已有的 show/电话咨询按钮可以保留，后续询价任务可独立替换。",
    "公开参考价格继续可见，收藏与询价保持独立，用户数据隔离和历史数据不被本任务删除或改写。",
    "nursery 插件未安装、未启用或 app/event.php 未生成时不得声称路由策略已生效；安装器、直连 FPM 和静态文件保护属于部署边界。"
  ],
  "dependencies": [
    "ShopXO 6.9.0 固定上游 d1825c5404054b535255d8fcad675a5dae0ab633 已通过 source-check。",
    "plugins_service_system_begin 在 index/api/admin 公共控制器的业务动作之前触发，但其返回值被忽略，因此拒绝路径必须抛出 ThinkPHP HTTP 异常而不是只返回 DataReturn。",
    "插件必须经 ShopXO 安装并启用后由 PluginsAdminService 生成 app/event.php；本任务不手工维护该生成文件。",
    "本机没有 PHP、Composer、MySQL 或 Docker；提交前可执行离线合同测试，真实运行时路由和页面验收必须在后续受控部署任务补齐。"
  ],
  "allowed_paths": [
    "app/plugins/nursery/**",
    "tests/nursery/**"
  ],
  "forbidden_paths": [
    ".env",
    ".env.*",
    "rsakeys/**",
    "vendor/**",
    "runtime/**"
  ],
  "shopxo_core_change": {
    "required": false,
    "paths": [],
    "reason": "",
    "registration": ""
  },
  "database_change": {
    "required": false,
    "affected_tables": [],
    "migration_paths": [],
    "fresh_install_baseline_exception": {
      "requested": false,
      "reason": ""
    },
    "rollback_plan": "本任务不改变数据库结构或数据；运行环境回滚时先禁用 nursery 插件并由 ShopXO 重新生成 app/event.php，再回退本任务文件。",
    "verification": "确认 Git diff 不包含 config/shopxo.sql、迁移、install.sql、update.sql、uninstall.sql 或数据库写入逻辑。"
  },
  "new_dependency_allowed": false,
  "network_access_required": false,
  "acceptance_criteria": [
    {
      "id": "AC-TASK-001",
      "requirement_ids": [
        "FR-HOME-001",
        "FR-CENTER-001"
      ],
      "description": "插件配置登记全部必要 Hook，首页顶部和移动底部导航、用户中心菜单/首页及商品详情均不再输出购物车、结算、订单、支付、售后或积分入口。"
    },
    {
      "id": "AC-TASK-002",
      "requirement_ids": [
        "FR-HOME-001",
        "FR-CENTER-001"
      ],
      "description": "任务合同列明的 Web 8 个、API 10 个、后台 12 个控制器，以及固定 PX 插件标识集合统一返回不可达；大小写变体和非 index action 不能绕过，后台四类菜单/权限数组不再含对应能力。"
    },
    {
      "id": "AC-TASK-003",
      "requirement_ids": [
        "FR-HOME-001",
        "FR-CENTER-001"
      ],
      "description": "index、category、search、goods、user、personal、safety、usergoodsfavor、usergoodsbrowse 与 nursery 插件路由不在拒绝集合，收藏和浏览历史入口保留，且上游被排除模块源码与数据库表没有被删除或修改。"
    }
  ],
  "required_tests": [
    {
      "id": "nursery_scope_contract",
      "description": "离线验证 nursery 插件清单、Hook、固定拒绝表、菜单和按钮过滤、用户中心替换视图及正负路由边界。",
      "command": [
        "python",
        "tests/nursery/test_scope_contract.py"
      ],
      "cwd": ".",
      "timeout_seconds": 120
    },
    {
      "id": "harness_selftest",
      "description": "确认业务任务没有削弱 Harness 的范围、审批、证据和状态门禁。",
      "command": [
        "python",
        "scripts/harness_selftest.py"
      ],
      "cwd": ".",
      "timeout_seconds": 300
    }
  ],
  "rollback": {
    "required": true,
    "plan": "尚未部署时仅还原 app/plugins/nursery/** 与 tests/nursery/**。已部署时先在维护窗口禁用 nursery 插件并确认 ShopXO 重新生成的 app/event.php 不再引用插件，再回退任务提交；不删除原商城源码和历史数据。",
    "verification": "运行 source-check 与 Harness 自检，确认 app/event.php 不再注册 nursery Hook、被本任务拒绝的上游路由恢复到部署前状态，并确认分类、商品、用户、收藏和历史数据行数未变化。"
  },
  "manual_approvals": {
    "plan": {
      "required": true,
      "status": "approved",
      "approved_by": "Codex-Review",
      "approved_at": "2026-07-13T13:56:27Z"
    },
    "merge": {
      "required": true,
      "status": "pending",
      "approved_by": null,
      "approved_at": null
    },
    "release": {
      "required": false,
      "status": "not_required",
      "approved_by": null,
      "approved_at": null
    }
  },
  "codex_role_bindings": {
    "implementation": {
      "agent_task": "/root",
      "thread_id": "019f566b-dffa-7913-a608-bc2dffbd2bea"
    },
    "plan": {
      "agent_task": "/root/feat001_plan_review_v3"
    },
    "merge": {
      "agent_task": "/root/feat001_merge_review"
    },
    "release": null
  },
  "owner": "Codex-Implementer",
  "reviewer": "Codex-Review",
  "release_approver": null,
  "created_at": "2026-07-13T13:24:31Z",
  "updated_at": "2026-07-13T13:57:21Z"
}
